{
  "anomaly_type": "I/O延迟抖动",
  "related_object": {
    "device": "8:0 sda"
  },
  "key_metrics": {
    "avg_lat_ms": 0.09,
    "iops": 175,
    "max_lat_ms": 0.52,
    "p99_lat_ms": 0.52,
    "queue_depth": 2,
    "throughput_mbps": 1.82
  },
  "time_window": {
    "start": "2026-07-09T13:05:21Z",
    "end": "2026-07-09T13:05:22Z"
  },
  "suspected_root_cause": "I/O 时延抖动，疑似热点设备访问集中或页缓存失效导致回源磁盘",
  "confidence": 0.78,
  "evidence_chain": [
    {
      "type": "metric",
      "name": "p99_lat_ms",
      "value": 0.52,
      "threshold": 0.5,
      "desc": "请求完成时延 P99"
    },
    {
      "type": "metric",
      "name": "avg_lat_ms",
      "value": 0.09,
      "desc": "平均完成时延"
    },
    {
      "type": "metric",
      "name": "max_lat_ms",
      "value": 0.52,
      "desc": "最大完成时延"
    },
    {
      "type": "metric",
      "name": "iops",
      "value": 175,
      "desc": "每秒完成请求数"
    },
    {
      "type": "metric",
      "name": "throughput_mbps",
      "value": 1.82,
      "desc": "吞吐(MB/s)"
    },
    {
      "type": "metric",
      "name": "queue_depth",
      "value": 2,
      "desc": "当前在途请求数(队列深度)"
    }
  ],
  "suggestion": "排查热点文件/设备访问模式，增大缓存命中或顺序化访问；必要时分散负载到多设备"
}
