{
  "anomaly_type": "锁竞争",
  "related_object": {
    "pid": 98007,
    "tid": 98007,
    "comm": "stress-ng-mutex"
  },
  "key_metrics": {
    "affected_tid_count": 16,
    "block_count": 1610812,
    "last_waker_tid": 98015,
    "max_offcpu_ms": 16.78,
    "merged_report_count": 164,
    "offcpu_ratio": 0.67,
    "stack_status": "symbolized",
    "suppressed_report_count": 163
  },
  "time_window": {
    "start": "2026-07-09T13:13:57Z",
    "end": "2026-07-09T13:14:57Z"
  },
  "suspected_root_cause": "多线程争用同一锁资源导致阻塞（off-CPU 等锁，疑似临界区过大或锁粒度过粗）",
  "confidence": 0.9,
  "evidence_chain": [
    {
      "type": "event",
      "name": "affected_tid_count",
      "value": 16,
      "desc": "聚合窗口内涉及的线程数量"
    },
    {
      "type": "event",
      "name": "block_count",
      "value": 1610812,
      "desc": "窗口内阻塞切出次数"
    },
    {
      "type": "event",
      "name": "last_waker_tid",
      "value": 98015,
      "desc": "最近唤醒该线程者(唤醒链上游，疑似持锁方)"
    },
    {
      "type": "event",
      "name": "stack_status",
      "value": "symbolized",
      "desc": "阻塞栈符号化状态"
    },
    {
      "type": "event",
      "name": "suppressed_report_count",
      "value": 163,
      "desc": "同类报告聚合后被压缩的条数"
    },
    {
      "type": "metric",
      "name": "max_offcpu_ms",
      "value": 16.78,
      "desc": "单次最长阻塞时长(毫秒)"
    },
    {
      "type": "metric",
      "name": "offcpu_ratio",
      "value": 0.67,
      "threshold": 0.1,
      "desc": "阻塞型 off-CPU 时间占墙钟比例"
    },
    {
      "type": "stack",
      "name": "frame_0",
      "func": "__schedule",
      "desc": "阻塞点内核调用栈"
    },
    {
      "type": "stack",
      "name": "frame_1",
      "func": "__schedule",
      "desc": "阻塞点内核调用栈"
    },
    {
      "type": "stack",
      "name": "frame_2",
      "func": "rt_mutex_schedule",
      "desc": "阻塞点内核调用栈"
    },
    {
      "type": "stack",
      "name": "frame_3",
      "func": "rt_mutex_slowlock_block.constprop.0",
      "desc": "阻塞点内核调用栈"
    },
    {
      "type": "stack",
      "name": "frame_4",
      "func": "rt_mutex_wait_proxy_lock",
      "desc": "阻塞点内核调用栈"
    },
    {
      "type": "stack",
      "name": "frame_5",
      "func": "futex_lock_pi",
      "desc": "阻塞点内核调用栈"
    },
    {
      "type": "stack",
      "name": "frame_6",
      "func": "do_futex",
      "desc": "阻塞点内核调用栈"
    },
    {
      "type": "stack",
      "name": "frame_7",
      "func": "__x64_sys_futex",
      "desc": "阻塞点内核调用栈"
    }
  ],
  "suggestion": "缩小临界区/细化锁粒度，排查唤醒链上游持锁线程 tid=98015；可改用读写锁或无锁结构"
}
