{
  "anomaly_type": "I/O延迟抖动",
  "related_object": {
    "device": "8:0 sda"
  },
  "key_metrics": {
    "avg_lat_ms": 10.74,
    "iops": 636,
    "max_lat_ms": 268.44,
    "merged_report_count": 4,
    "p99_lat_ms": 268.44,
    "queue_depth": 3898,
    "suppressed_report_count": 3,
    "throughput_mbps": 5.23
  },
  "time_window": {
    "start": "2026-07-09T12:03:15Z",
    "end": "2026-07-09T12:03:47Z"
  },
  "suspected_root_cause": "随机读写压力导致设备队列拥堵（队列深度 3898，队列过深）",
  "confidence": 0.9,
  "evidence_chain": [
    {
      "type": "event",
      "name": "suppressed_report_count",
      "value": 3,
      "desc": "同类报告聚合后被压缩的条数"
    },
    {
      "type": "metric",
      "name": "avg_lat_ms",
      "value": 10.74,
      "desc": "平均完成时延"
    },
    {
      "type": "metric",
      "name": "iops",
      "value": 636,
      "desc": "每秒完成请求数"
    },
    {
      "type": "metric",
      "name": "max_lat_ms",
      "value": 268.44,
      "desc": "最大完成时延"
    },
    {
      "type": "metric",
      "name": "p99_lat_ms",
      "value": 268.44,
      "threshold": 0.5,
      "desc": "请求完成时延 P99"
    },
    {
      "type": "metric",
      "name": "queue_depth",
      "value": 3898,
      "desc": "当前在途请求数(队列深度)"
    },
    {
      "type": "metric",
      "name": "throughput_mbps",
      "value": 5.23,
      "desc": "吞吐(MB/s)"
    }
  ],
  "suggestion": "降低并发/队列深度(iodepth)，或评估更高 IOPS 的存储；排查是否随机小块写密集"
}
